{
  "AF": "Afganistan",
  "AX": "Wyspy Alandzkie",
  "AL": "Albania",
  "DZ": "Algeria",
  "AS": "Samoa Amerykańskie",
  "AD": "Andora",
  "AO": "Angola",
  "AI": "Anguilla",
  "AQ": "Antarktyda",
  "AG": "Antigua i Barbuda",
  "AR": "Argentyna",
  "AM": "Armenia",
  "AW": "Aruba",
  "AU": "Australia",
  "AT": "Austria",
  "AZ": "Azerbeidżan",
  "BS": "Bahamy",
  "BH": "Bahrain",
  "BD": "Bangladesz",
  "BB": "Barbados",
  "BY": "Białoruś",
  "BE": "Belgia",
  "BZ": "Belize",
  "BJ": "Benin",
  "BM": "Bermudy",
  "BT": "Bhutan",
  "BO": "Boliwia",
  "BQ": "Bonaire, Sint Eustatius i Saba",
  "BA": "Bośnia i Hercegowina",
  "BW": "Botswana",
  "BV": "Wyspa Bouveta",
  "BR": "Brazylia",
  "IO": "Brytyjskie Terytorium Oceanu Indyjskiego",
  "BN": "Brunei Darussalam",
  "BG": "Bułgaria",
  "BF": "Burkina Faso",
  "BI": "Burundi",
  "KH": "Kambodża",
  "CM": "Kamerun",
  "CA": "Kanada",
  "CV": "Wyspy Zielonego Przylądka",
  "CW": "Curaçao",
  "KY": "Kajmany",
  "CF": "Republika Środkowoafrykańska",
  "TD": "Czad",
  "CL": "Czile",
  "CN": "Chiny",
  "CX": "Wyspa Bożego Narodzenia",
  "CC": "Wyspy Kokosowe (Keelinga)",
  "CO": "Kolumbia",
  "KM": "Komory",
  "CG": "Kongo",
  "CD": "Kongo, Demokratyczna Republika",
  "CK": "Wyspy Cooka",
  "CR": "Kostaryka",
  "CI": "Cote Divoire",
  "HR": "Chorwacja",
  "CU": "Kuba",
  "CY": "Cypr",
  "CZ": "Czechy",
  "DK": "Dania",
  "DJ": "Dżibuti",
  "DM": "Dominika",
  "DO": "Dominikana",
  "EC": "Ekwador",
  "EG": "Egipt",
  "SV": "Salwador",
  "SX": "Sint Maarten",
  "GQ": "Gwinea Równikowa",
  "ER": "Erytrea",
  "EE": "Estonia",
  "ET": "Etiopia",
  "FK": "Falklandy (Malwiny)",
  "FO": "Wyspy Owcze",
  "FJ": "Fidżi",
  "FI": "Finlandia",
  "FR": "Francja",
  "GF": "Gujana Francuska",
  "PF": "Polinezja Francuska",
  "TF": "Francuskie Terytoria Południowe",
  "GA": "Gabon",
  "GM": "Gambia",
  "GE": "Gruzja",
  "DE": "Niemcy",
  "GH": "Ghana",
  "GI": "Gibraltar",
  "GR": "Grecja",
  "GL": "Grenlandia",
  "GD": "Grenada",
  "GP": "Gwadelupa",
  "GU": "Guam",
  "GT": "Gwatemala",
  "GG": "Guernsey",
  "GN": "Gwinea",
  "GW": "Gwinea Bissau",
  "GY": "Gujana",
  "HT": "Haiti",
  "HM": "Wyspy Heard i McDonalda",
  "VA": "Stolica Apostolska (Państwo Watykańskie)",
  "HN": "Honduras",
  "HK": "Hong Kong",
  "HU": "Węgry",
  "IS": "Islandia",
  "IN": "Indie",
  "ID": "Indonezja",
  "IR": "Iran",
  "IQ": "Irak",
  "IE": "Irlandia",
  "IM": "Wyspa Man",
  "IL": "Izrael",
  "IT": "Włochy",
  "JM": "Jamajka",
  "JP": "Japonia",
  "JE": "Jersey",
  "JO": "Jordania",
  "KZ": "Kazachstan",
  "KE": "Kenia",
  "KI": "Kiribati",
  "KP": "Korea, Republika Ludowo-Demokratyczna",
  "KR": "Republika Korei",
  "KW": "Kuwejt",
  "KG": "Kirgistan",
  "LA": "Laotańska Republika Ludowo-Demokratyczna",
  "LV": "Łotwa",
  "LB": "Liban",
  "LS": "Lesoto",
  "LR": "Liberia",
  "LY": "Libia",
  "LI": "Liechtenstein",
  "LT": "Litwa",
  "LU": "Luksemburg",
  "MO": "Specjalny Region Administracyjny Makau w Chinach",
  "MK": "Macedonia Północna",
  "MG": "Madagaskar",
  "MW": "Malawi",
  "MY": "Malezja",
  "MV": "Malediwy",
  "ML": "Mali",
  "MT": "Malta",
  "MH": "Wyspy Marshalla",
  "MQ": "Martynika",
  "MR": "Mauretania",
  "MU": "Mauritius",
  "YT": "Majotta",
  "MX": "Meksyk",
  "FM": "Mikronezja, Sfederowane Stany",
  "MD": "Mołdawia, Republika",
  "MC": "Monako",
  "MN": "Mongolia",
  "ME": "Czarnogóra",
  "MS": "Montserrat",
  "MA": "Maroko",
  "MZ": "Mozambik",
  "MM": "Myanmar",
  "NA": "Namibia",
  "NR": "Nauru",
  "NP": "Nepal",
  "NL": "Niderlandy",
  "NC": "Nowa Kaledonia",
  "NZ": "Nowa Zelandia",
  "NI": "Nikaragua",
  "NE": "Niger",
  "NG": "Nigeria",
  "NU": "Niue",
  "NF": "Wyspa Norfolk",
  "MP": "Mariany Północne",
  "NO": "Norwegia",
  "OM": "Oman",
  "PK": "Pakistan",
  "PW": "Palau",
  "PS": "Palestyna",
  "PA": "Panama",
  "PG": "Papua Nowa Gwinea",
  "PY": "Paragwaj",
  "PE": "Peru",
  "PH": "Filipiny",
  "PN": "Pitcairn",
  "PL": "Polska",
  "PT": "Portugalia",
  "PR": "Portoryko",
  "QA": "Katar",
  "RE": "Réunion",
  "RO": "Rumunia",
  "RU": "Federacja Rosyjska",
  "RW": "Rwanda",
  "BL": "Saint Barthelemy",
  "SH": "Saint Helena i Tristan da Cunha",
  "KN": "Saint Kitts i Nevis",
  "LC": "Saint Lucia",
  "MF": "Saint Martin",
  "PM": "Saint Pierre i Miquelon",
  "VC": "Saint Vincent i Grenadyny",
  "WS": "Samoa",
  "SM": "San Marino",
  "SS": "Południowy Sudan",
  "ST": "Wyspy Świętego Tomasza i Książęca",
  "SA": "Arabia Saudyjska",
  "SN": "Senegal",
  "RS": "Serbia",
  "SC": "Seszele",
  "SL": "Sierra Leone",
  "SG": "Singapur",
  "SK": "Słowacja",
  "SI": "Słowenia",
  "SB": "Wyspy Salomona",
  "SO": "Somalia",
  "ZA": "Afryka Południowa",
  "GS": "Georgia Południowa i Sandwich Południowy",
  "ES": "Hiszpania",
  "LK": "Sri Lanka",
  "SD": "Sudan",
  "SR": "Surinam",
  "SJ": "Svalbard i Jan Mayen",
  "SZ": "Eswatini",
  "SE": "Szwecja",
  "CH": "Szwajcaria",
  "SY": "Republika Syryjsko-Arabska",
  "TW": "Tajwan",
  "TJ": "Tadżykistan",
  "TZ": "Tanzania, Zjednoczona Republika",
  "TH": "Tajlandia",
  "TL": "Timor Wschodni",
  "TG": "Togo",
  "TK": "Tokelau",
  "TO": "Tonga",
  "TT": "Trinidad i Tobago",
  "TN": "Tunezja",
  "TR": "Turcja",
  "TM": "Turkmenia",
  "TC": "Wyspy Turks i Caicos",
  "TV": "Tuvalu",
  "UG": "Uganda",
  "UA": "Ukraina",
  "AE": "Zjednoczone Emiraty Arabskie",
  "GB": "Wielka Brytania",
  "US": "Stany Zjednoczone",
  "UM": "Stany Zjednoczone Dalekie Wyspy Mniejsze",
  "UY": "Urugwaj",
  "UZ": "Uzbekistan",
  "VU": "Vanuatu",
  "VE": "Wenezuela",
  "VN": "Wietnam",
  "VG": "Wyspy Dziewicze, Brytyjskie",
  "VI": "Wyspy Dziewicze Stanów Zjednoczonych",
  "WF": "Wyspy Wallis i Futuna",
  "EH": "Sahara Zachodnia",
  "YE": "Jemen",
  "ZM": "Zambia",
  "ZW": "Zimbabwe"
}
